review_id,user_id,business_id,stars,useful,funny,cool,text,date
rsVqYKtEZykBZqwur6QyVw,HFFiM63x9asevqVOZG5GBQ,L8rJht4Jw_BuR8gsckEWYg,5.0,0,0,0,"Famous for its cheesecake and infamous for its two-hour waits, I must admit up front that I had no intention of liking this restaurant. I considered it to be over hyped and overrated; however, after a very satisfying early Saturday lunch, I now feel completely different.

We arrived at 11:00AM and were seated immediately, fortunately in Melissa's section. We had a $50 gift card to play with. We started things off with a very tasty beet and goat cheese salad for $7.95. Fresh and warm honey wheat and sourdough loaves were also served and were very satisfying.

For our entrees, my wife ordered the smoked salmon which was thinly sliced and doused with a balsamic glaze for $11.95, and I ordered the French country salad with chicken for $15.95. Both were quite good. We intentionally kept things light, knowing that we were each going to do some serious damage to cheesecake for dessert. 

As an admitted dessert snob, I did have my doubts regardless of the fact that cheesecake was their specialty. I never consider any dessert unless it's made in house and most of the time they are not.

After drooling over the choices on the menu and in the display case, we finally settled on the Oreo and the praline. Slices are huge and run a very reasonable $7.95 when compared to similar restaurants. More importantly, they were other worldly! The Oreo cheesecake had fresh crunchy Oreos baked in, an Oreo crust and was topped with crushed Oreos and fresh whipped cream. The praline was equally as good and was topped with Nutella and fresh creme. No we didn't finish them both but we sure did enjoy them there and at home. I am nonsmoker, and never have, but I almost had to have a cigarette afterwards. Yes it was that good!

Hey what can I say, I was wrong. No wonder people wait 2 hours to dine here. I won't do that anywhere no matter how great but I will return for another 11:00 Saturday lunch. By the way, when we left at 1:00 there was a 2 hour wait.

Overall, menu was huge, the food was great, the cheesecake incredible, service provided by Melissa was attentive and helpful, and the atmosphere was comfortable and fun. And on top of everything else, it had a 96 sanitary rating. There's no way I can give it anything but five stars! And of course it is a Gotta Try!",2017-02-09 04:06:45
T5dE90hplvP7UWQqYxYMTg,K1osyO04_hXoDKyGqe_V2Q,L8rJht4Jw_BuR8gsckEWYg,2.0,0,0,0,"I want to preface this review by admitting I didn't want to come here and I don't like chain restaurants like this, but someone we were going out to eat with really wanted to go here.

The restaurant was crazy busy and it's huge, so it was really loud.  The tables are like a faux-marble type material, so when the bus-boys were setting the tables and throwing down the utensils repeatedly, the sounds got real old fast.

We went here for lunch  and got the nachos with chicken as our app.  There was literally 5 random pieces of chicken on the nachos and it was gross and the flavoring was super sweet, which is weird to put on nachos.  The chips were saturated in grease and I'm not really sure why...

I ordered the Monterrey Burger to be cooked medium.  It was burnt\/charred in some spots and completely brown throughout the burger.  It wasn't that great.  The arugula it came with was put on top of the hot burger, so it was all wilted and not the best consistency.  I only ate half my burger.  

We all got cheesecake since we felt like we kind of had to.  I ordered the Oreo cheesecake and it fell short IMO.  The cheesecake itself was delicious! However, it was covered in thick chocolate cake and it was so rich - I didn't eat that part.

Overall, it was pretty much what I expected from a place like this.",2013-06-24 15:00:55
j5MrhwuMcvNkHO4q5ocdWg,GOk6jLtou4Gufxo-rtX5ZA,L8rJht4Jw_BuR8gsckEWYg,5.0,0,0,0,"Went here for me and my boyfriends anniversary and it was so awesome. Our waiter, Joe, was honest with me when I asked him what his favorite cocktails were, and his favorite entree. He recommended the pineapple mojito which was delicious and the shepherds pie, which was probably one of the best meals I've had out to eat ever! Awesome service and food :)",2016-12-19 07:12:54
yHTyWcbGR30Y9tXB8nPpSQ,BCHZd09vfR1ztLlFeTrzbQ,L8rJht4Jw_BuR8gsckEWYg,1.0,0,0,0,"I'm not sure if I came in at a bad time... I came in for lunch with my friend and it was certainly busy. When we were seated our waitress was very friendly at first. She was very attentive (which she should be considering how expensive this restaurant is). I ordered the Fettuccine Alfredo and when it came out it looked delicious. It tasted absolutely HORRIBLE... It was loaded down with garlic and it ended up making me throw-up sick. I called the manager over and he didn't offer to take it off the check or anything. I told him to just bring me a burger to go. The waitress came back out about 30 minutes later with the burger and it wasn't in a to-go box. I had to ask her to bring me a box for it and she had an attitude. I said thank you and was continuously polite throughout my visit and she never said ""you're welcome"" or anything very polite back. Whenever I said ""thank you"" she just turned away. She wasn't horribly rude, but I definitely expect more for such an expensive restaurant. After we left, about 30 minutes later I had to go to the bathroom and throw up. I won' be coming back... This restaurant is not at all what it is talked up to be!!",2014-04-19 14:11:00
F813bToytGklZok1WVxl6w,X3h37GG6Za3qhVZiOnzIcw,L8rJht4Jw_BuR8gsckEWYg,2.0,3,0,0,"Ive eaten at Cheesecake Factory at other locations and had a much better experience, so here we go....We arrive around 12ish on a sunday, which was a horrible time at the South Park mall, dont do it, unless U are jus that bored.  We waited approx 1hr, didnt leave because we knew all the other restaurants would have the same wait time. Once we were seated it went all down hill from there. We didnt get a ""hey how are U"" nor good afternoon, The waitress Whitney K. acted as if we were a bother the whole time. I ordered the veggie appetizer, had to ask for sauce, then I ordered the fish and chips-  asked her if I could substitute the the cole slaw, she said ""no its a Garnish and we cant do that"". She never asked if I wanted to maybe pay extra for a salad or maybe another item. I had to ask for vinegar for my fish, not really understanding at this point why I didnt jus pay and leave. I was so done so no matter what she said or did I wasnt hearing it. Next I asked for the manager, he proceeded to listen and apologize. 

The food really wasnt good after all this mishap, we paid and I left no Tip, which I have never done, this could have been my child. But I feel U should give 100% at work at all times, if not GO home, plenty of people need a job. Im not always happy at work either but I make sure I dont reflect this in my service to the public. Once a manager or owner of a business has mastered this with there employees U will have happy customers who will wait and return. I went to Olive Garden the next day, and the staff were all 100% my waiter earned the 20% I left him. I never asked for anything, he was very professional and they were busy on Memorial Day!!

Now this tops it off, before leaving I saw Miss Whitney show my receipt to the manager, I left no TIP, she made a weird face to him....really do U expect me to leave my hard earned money to someone who was rude to my family???  I wont return, my coins will B spent elsewhere....ENUFFSAID",2016-05-31 01:54:07
g3IpPMhi6Pjm18cVQp31wA,eUs966DryNx82-091dRXrg,L8rJht4Jw_BuR8gsckEWYg,5.0,0,0,0,"We love Cheesecake Factory! We make it a point to stop in here for lunch anytime we are leaving Charlotte to go home to Columbia. Today we had a great experience! 

We started with Tuna Tartare, which was beautifully presented and very fresh. We loved it, and it was a nice diversion from some of their ""not so healthy"" appetizers. For lunch, I ordered my favorite Louisiana Chicken Pasta and the S.O. ordered teriyaki chicken. Both were excellent! Our server was awesome and we really had a great lunch with several drinks. We don't love corporate places, but this place is an exception to that rule!",2016-06-11 21:32:50
6Y0SbI7IVG3SHG-UKlwkhw,QnAab8WSB67O05yfolmclw,L8rJht4Jw_BuR8gsckEWYg,5.0,0,0,0,Hibatchi steak was delicious!!! I had the white chocolate macadamia nut cheesecake for dessert because how can you resist their cheesecake options. Very good!!!,2016-02-12 04:52:00
lblHcanoDhtF-jekCHepqQ,FSw3Kk2Ssn6vUe9asc5vsA,L8rJht4Jw_BuR8gsckEWYg,2.0,2,3,0,"You know, I get it--the cheesecake here is really really good.  But everything about this place is really really bad.  

First, I cannot get over the fact that this place tries to pass itself off as fancy (valet parking, for example) when it is a) called ""The Cheesecake Factory"" and b) ATTACHED TO A MALL--arguably two of the least fancy things imaginable.  

The inside of this place is basically a glorified cafeteria--just a loud din of noise, which makes it even crazier that people dress up to go here. The food itself (even that which is not cheesecake related) is incredibly caloric and fattening.  I spent most of my life trying to avoid this place, and, I realized today, for good reason--this place is just thoughtless excess at its finest.",2011-02-13 21:57:55
mH1Udbb581tDA4uVeI4xjw,r7RdCrF0SpzFoUWFb_8oyA,L8rJht4Jw_BuR8gsckEWYg,4.0,2,1,1,"Enjoyable Cheesecake Factory experience! I've missed you CF! Haven't eaten at this chain in years since I moved away. The wait was an hour (as usual) but we were promptly seated at an hour. Our server was very quick and courteous. We were seated in the far left corner of restaurant by window and it was awesome and quiet! I got the shepherds pie and it was delicious as always. The only thing that drove us a bit crazy was the Coke we ordered tasted like Diet Coke for our first refill, then when we mentioned it, the third tasted like Coke Zero! Weird! I stopped drinking soda this month so serves me right I guess... :( 

Will definitely return ! :)",2016-01-30 04:01:50
mr5cUQcVyz6xEVyGEdMTVw,ImsG09KYJ4cfp2ZF4rmLlw,L8rJht4Jw_BuR8gsckEWYg,4.0,0,0,0,"I recommend the shrimp scampi paired with well...anything. This continues to be my very favorite dish after 20 years. My most favorite version is the traditional way it comes with angel hair pasta, but it's also awesome with one of the combination choices, like the herb crusted salmon. And it's hard to go wrong with any of the cheesecake, of course.",2016-05-07 03:18:07
ZcMXgpxaa59gj9H5N3rUsg,fJBAsg3SITo9wAuUvdFsjA,L8rJht4Jw_BuR8gsckEWYg,1.0,0,0,0,my self and a few friends went the cheesecake factory on 12\/29\/17  I checked in around 640 and was told it would be an hour an 20 min which was fine. waiting on my party to arrive so after waiting and waiting yes the lobby was very crowded people every where . so after waiting for about 2 hours I went to desk and ask how much longer on my party and she said 15 mins more the buzzer finally went off . we were seated got drinks and finally food which the appetizers we order were sooooooo salty the buffalo blast which are my favorite .but this time were a let down to look salty the food we ordered came and everything my friends order was to salty and we really did not enjoy the food I will never return to this restaurant again I will go next door to maggiano. the food is too salty my friend left there with a blood pressure head ache. finally left the restaurant at 10 a total waste of time. stay away,2017-12-29 16:36:57
cl9kF7QX2HsdPai4YC-vEw,UOhsTndgSxGBu_bV0e88yw,L8rJht4Jw_BuR8gsckEWYg,5.0,1,0,0,"I had a delicious dinner. The chicken piccata was EXCELLENT!!! I am definitely a fan of angel hair pasta, and this one has a lemon sauce that just kept calling my name. The mushrooms and capers topped it off real fine. 
   The waiter was fantastic. He had a great sense of humor and was very observant. The bartender knows how to make a mean amaretto sour. 
   Can't go to the Cheesecake Factory and not order cheesecake..... The choices go on and on. I decided on the cherry cheesecake and I was not disappointed. It was good to the last bite. 
    Wish we had a Cheesecake Factory in Charleston, SC.
     10 out of 10!!!
YUMOLA!!!!",2018-04-04 15:53:05
FU1AqdzDsjm-TBQS05LLmg,3GcWh3GrdvgPsqPzAx7FNQ,L8rJht4Jw_BuR8gsckEWYg,5.0,1,0,0,"Now I know why they call it ""the Cheesecake Factory"" BEST cheesecake I ever had.  I ordered the sea salt and Carmel. The menu was literally 35 pages long, so it takes awhile to decide.  I went on a busy weekend night but my husband went up to the bar and ordered us Mai Tais and they were really good, we sat outside on a beautiful night with our mai Tais and people watched, the time went by quickly.  I ordered some spicy shrimp dish that was delicious, the bread was good and they had something for everyone. I will return.  Good service and not overly priced.",2016-05-31 05:17:05
gaRnRnT2gXEWd47Nb1gEPQ,AOVbO5VqXzPm0x01cFWV3A,L8rJht4Jw_BuR8gsckEWYg,3.0,1,0,0,"We had a great time at the cheesecake factory. We sat outside an the weather was great. The food was excellent. I had the shrimp and chicken gumboo....hummm humm.  Goood!!! My hubby had the flip flop salmon special. As usual he is not sure of the item but I know it was a special. It was great. The waitress was good, but we ordered drinks and had to ask if they were coming before or after we finished the food....lol  The Mai Tai made it...an it was gr8. We will definitely return as the summer time has a shorter wait time.",2013-07-13 19:52:54
MafD9Rlg9JcbzYH8auypBg,kMLLHLIvUBXyPusIA6I1tQ,L8rJht4Jw_BuR8gsckEWYg,3.0,0,0,0,Now I found my second favorite item on the 100 page menu. The truffle bacon cheese bread. It's delectable and delicious. I really coulda just had that - since it's was like a grilled cheese - an awesome high brow grilled cheese cut into 4 strips! I'm only giving 3 stars cause the pasta a order was ok. Basic. But my shrimp were terribly over cooked. Which I paid extra to add em. Live and learn.,2017-06-06 23:56:13
dIUQ9KCk7xyoanO8CDGvfg,HhYUDP1vR7CSRi2cvfai0Q,L8rJht4Jw_BuR8gsckEWYg,3.0,0,0,0,"Generally speaking I'm not a chain restaurant fan. This place is decent though. We came tonight for my moms birthday and I get the appeal for her. She's a midwestern bland food kind of person. Nothing wrong with that, but I am the exact opposite so I only find it ""ehhh"". The menu is insanely large and overwhelming. Seriously, I've never seen a restaurant have so many options and I'm not sure that's a good thing either. The prices are also very high, however one entree is enough food for two people so it evens out... Seriously the portions are ENORMOUS. I finally decided on the Parmesan crusted chicken and it came with mashed potatoes and green beans. The chicken tasted good but the Parmesan crust was soggy. The green beans were bland and underdone but the mashed were very good. It did take forever to get our food. This is definitely not the place to go if you're in a hurry. I love their pineapple upside down cheesecake however it's seasonal and not available... I haven't had it in years so it may not even be a thing anymore. I opted for the original; not bad but obviously comes in frozen and then thawed for sale. My mom got the key lime cheesecake and I wasn't a fan. I prefer New York style cheesecake and this was really thin. However if you prefer the thinner version you will love it and huge bonus point the whipped cream is homemade and not from a can!! Overall it's an a-okay place for a meal. It absolutely knows it's audience and appeals to them successfully. I get the success, just not a place I will be a regular at.",2016-11-22 02:51:34
WSWpvX4Rc6-0ikm_x6pObw,l0MBP2olaZc5_SP5nWTCWg,L8rJht4Jw_BuR8gsckEWYg,4.0,3,1,2,"I like Cheesecake Factory not just for the cheesecakes. Good selection of food for lunch or dinner.  I had the shrimp and chicken gumbo and was able to get brown rice with that which is great. The menu has plenty of burgers, sandwiches, steaks, burritos, etc. good selection of salads as well. 
The downside to Cheesecake Factory is the wait to get a table. They are usually pretty busy during normal meal times. I was with a large group and was told the wait would be 30 to 45 minutes but we only waited about 20 minutes.",2015-07-28 19:41:39
6x0MI4sDIZjaBjKd0QjO0w,4rgp_DxLgTvJFfbDcKGXiw,L8rJht4Jw_BuR8gsckEWYg,4.0,2,0,0,"I had always seen The Cheesecake Factory at malls and never had a desire to have a go at it.  Though this passed week I was with family and they had so much good things to say about it, we decided on it for lunch.  
The menu had just about everything you could imagine.  The family and I Had a wonderful meal, the food was excellent with  something for everyone.  There was a variety of choices to pick from and the portions were absolutely monstrous.
The service was timely, well executed and gave us refills promptly.  We finished the meal with desert and man the cheesecake was outstanding.  If you are in the area and want a meal of what felt like an endless amount of food, you should give it a shot.",2017-09-21 01:08:02
h3pBwZOk_WgbUlzWjVRlhw,OEa3JU_fXWtkM4nZjNp8rg,L8rJht4Jw_BuR8gsckEWYg,4.0,0,2,0,"This place is GORGEOUS! I have to say that the decor is like nothing I have ever seen in a restaurant. Very high ceilings and a gorgeous, well stocked bar. Waiters wear all white (shirt, pants, shoes and even the belt is white) and are very friendly\/attentive. We had sun dried tomato pasta and a pizza. Finished it off with Red Velvet Cheesecake....big enough to share, and OMG delicious! My only ""gripe"" is that they serve free bread baskets and we never got one, forcing us to order an appetizer because my blood sugar was crashing and I needed food quickly. Fried zuchinni was to die for, and for only $5 it is a very cheap appetizer. Overall, very good and can't wait to go back!
PS, the menu is an actual book, so there is something for everyone!",2012-06-27 04:54:31
sSwaHT9kUTeP78JBcC4XmA,VlMwYAZRkCA7k1nqo2YE1w,L8rJht4Jw_BuR8gsckEWYg,5.0,0,0,0,Alex was our waiter and he was awesome! We celebrated our 35th and our daughter's 5th wedding anniversary ... dinner was delicious and of course the cheesecake was the best!!,2017-07-08 22:23:33
-6QeB6TwiuTraDMB4Lfzfw,69shVIf4wXO7tpeXYOBTtw,L8rJht4Jw_BuR8gsckEWYg,1.0,1,0,0,"We come here once in a while mostly for special occasions or when we really crave it , so we went for dinner last night , and we ordered the calamari I had two pieces of it on my third one I found a long black hair fried into the calamari , we finally got our servers attention after about 15 min . He called the manager who just came over and looked irritated he just said we will switch it out no sorry's or anything . We finally got the calamari after our entres and almost at the end of the meal so what's the point of that ""appetizer"" .So we got our entrees I ordered a steak Diane and our server didn't brother to bring a steak knife until my husband finally flagged him down again and he looked irritated, we also got the shrimp scampi which didn't come with the angel pasta as so that's what our server told us I looked up in the website and it clearly says its served with angel pasta and our server just said oh it's separate and left quickly. Seemed like he didn't want to serve us , me and my husband are pretty young we are 23 and maybe he thought we wouldn't leave him a good tip but we always do when we dine out . Very disappointed with our meal and the service it sucks  because we really enjoyed coming here .We paid almost $70 for a meal that was all messed up .",2018-07-26 16:34:02
SiOoXYiEQckLVVBD80CNNg,5D-dRCD5dqy8Pe99LgKFxg,L8rJht4Jw_BuR8gsckEWYg,4.0,0,0,0,"The wait was pretty long, but that was expected as it was Saturday night and we didn't make reservations.  The food was fabulous.  Cheesecake was the best as usual.  I love having enough food leftover for a midnight snack!",2015-04-29 17:22:07
lQ7ihpsYnMp0D-riC023XA,NZLjfPSK53WB5DfNkcza0g,L8rJht4Jw_BuR8gsckEWYg,4.0,0,0,0,"First time to eat here. Don't understand why we had to give our name and wait to be called before being seated as we were one of the first customers they had and the place was still empty.  It did fill up fast though.  Over all a good experience. Was busy at opening with people waiting to get in. Service seemed a little slow and we had to wait quite some time for our food.  Mostly the only complaint I have.  Though a slice of cheesecake was a bit much at $7.95,  but I guess they have to make their money someway. I would eat here again.",2017-07-29 08:02:17
vV3zhyB79NcpSrJnYEINQQ,Z78cyMz4pFylsCgWwFqSXA,L8rJht4Jw_BuR8gsckEWYg,4.0,1,0,2,"I'll make this short and simple. The wait time was not very bad for a pre-4th of July dinner eating. Only had to wait 45 minutes or so. The food is good, just like and Cheesecake Factory that I have been to...Wait, it's Cheesecake Factory, the food is AWESOME! The only reason that I am giving this 4 stars and not five is that we had an annoying waiter and waitress issue at the beginning of our service. There were 4 people that saw us in the first 10 minutes of being there. We ordered drinks with 3 different people and then almost ordered dinner with two people. Finally when we got our waitress she was awesome!

I got the Bang Bang Chicken and Shrimp, awesome as usual! P.S. I need to try something new next time. I got the chocolate cake, 5 stars for that! It even tasted better the next day!",2015-07-05 15:00:42
oZA2gNiabvi_pKX4itk-9A,ZpwPC2Dpj3OsN0JsFFwmdQ,L8rJht4Jw_BuR8gsckEWYg,4.0,1,0,0,Really great service.  The wait wasn't long even though it was crowded.  We sat at the bar while we waited for our table.  The staff was very kind and attentive despite how busy it was.  Ordered steak that was prepared well.  Martinis were perfect.  They have a lot to choose from and the cheesecake was pretty good.,2015-11-18 22:54:46
0_amzs9du0v9iSX4ilbfYg,tN5OWA20rTvpJgtVw-eJMA,L8rJht4Jw_BuR8gsckEWYg,5.0,0,0,0,Great place to eat at me and my fiancée had a great time there and the waiter was great at her job. I would recommend going back again soon,2017-01-28 09:04:50
78IpmJleuVKIySxWv6Mbow,-Z7qT8zAczflAlu8TonYGg,L8rJht4Jw_BuR8gsckEWYg,1.0,0,0,0,I was really disappointed with my foods and services! We came in at 1:50 pm and waited for 15 mins just to order our drinks!!! And we didn't get our food till 1 hour later....and waited for 40mins for him to stop by so I can request for our check! This is ridiculous!!!!!! If I can give negative stars! I would!!!,2013-11-14 20:26:27
7Ubhgt-tSzT_cZTNyf89Tw,QXaRek__Hiw1UuyfzZ6DKQ,L8rJht4Jw_BuR8gsckEWYg,3.0,0,0,0,"if you have friends visiting town, this is such a great place to take them.  With one of the most beautiful and unique decors I've seen, plus the South Park location, you just can't go wrong.  And where else do you go where the menu is literally like a small book?!

That huge menu selection can seem a bit overwhelming, so ask the servers for suggestions if you need to.  I really enjoy their small plates and find the selection to be nicely varied over several different styles of food.  Several of the menu selections are also inventive and fun.  If you're not on the small plates menu, make some room because the rest of the portions are what I like to call ""ginormous""!  Everything is good, though, every time.

Now, don't forget to flip to the back TWO pages of that menu-novella.  You MUST at least consider the decadence of a slice of cheesecake.  Overwhelmed again?  Just close your eyes and point, it's impossible to make a bad choice.  (Hmm.. maybe I like cheesecake more than I realized)

My rating is 3 stars for one reason.. price.  It's not the best deal you'll find, but I also understand you're paying for some ambiance and style here.  It is a way, however, to dine in a really nice area with some wow-factor thrown in.",2012-08-16 17:26:27
8zzeoKgKI4yWzP9UX5Abdw,MRCZuUCLaUwxar6FnyJf4A,L8rJht4Jw_BuR8gsckEWYg,4.0,1,0,0,"I have heard a lot of good things about The Cheesecake Factory in my travels and on my recent trip to Charlotte I got a chance to visit one. I was immediately wowed by the general style of the place and felt like I should have worn something a little nicer. The staff was friendly and the menu was almost too big. Portions were decent and prices were about what you would expect. I got the Garlic Noodles with chicken and was surprised to find bones in the chunks of chicken they put on. Then came the cheese cake, which was fantastic. I would come here again, no doubt about it.",2013-10-03 21:47:32
MpG9I1y3h0Xhy5GRIKXSkA,2xLBFCtjaREAPUE2KBpA0g,L8rJht4Jw_BuR8gsckEWYg,3.0,0,0,0,"The wait was long on Wednesday night, we were sitting down looking at empty tables for 10 minutes before we were seated. Total wait time was 20 minutes though.

The bread they brought to the table was cold and hard and the butter was in individual packages equally cold. The food was good when we got it. I loved the LUAU SALAD. It was so delicious and plentiful. 14.95 is kinda high for a salad but it was worth it.",2016-03-31 23:04:25
CeBAOUvNIi7aXPmNAMK4Eg,X5m2-pjKY4oPmfvTsZOddw,L8rJht4Jw_BuR8gsckEWYg,5.0,0,0,0,Food was amazing as always. Took cheesecake and leftovers home which were still awesome the next day!!,2015-09-01 10:49:42
hh0xi6e_HdMS234ZUmRFww,FckJWKjzZHnT51jKD82lYw,L8rJht4Jw_BuR8gsckEWYg,4.0,0,0,0,"Let me tell you about our amazing experience at the Cheesecake Factory! I've been meaning to write this review for awhile. My boyfriend and I just came for cheesecake, which was amazing per usual. We also asked for our leftover bread to go, but Jonathan L came in clutch and gave us AN entire loaf. We will definitely come back to this location. His service was also on point!!",2018-05-29 01:18:21
