review_id,user_id,business_id,stars,useful,funny,cool,text,date
4Xlv_xLAG1RrCNqHJO-Oow,62GNFh5FySkA3MbrQmnqvg,L8rJht4Jw_BuR8gsckEWYg,3.0,9,5,3,"Walking into The Cheesecake Factory (at night) reminds me of a Las Vegas Casino.  Not the downtown casinos that are all closed in and almost claustrophobic, mind you, but the expansive Steve Wynn casinos on the strip.  It's huge.  It borders on gaudy, but in a nice way.  You also can't really tell what time of day it is - probably so you don't mind how long you wait for your server to come back to you (though we did).

I'd imagine that during the day, the monstrous windows in the front of the place give it a ton of light, and it would be a completely different feel, but at night, it just gave that vibe.  The noise is pretty incredible too - like the old noise of casinos (they don't have noise any more, sad to say).

As to the food - pretty impressive overall.  I just wish that they didn't have 300 items on the menu.  And I didn't count, the server gave that number when I asked for a suggestion since I didn't feel like opening the tome of selections.  I eventually settled on one of the items from the specials list (Caramel Chicken).

We also had some crab cake appetizers, a massive double BBQ burger, a chicken sandwich and an order of popcorn shrimp.  The fried food overall was the worst.  The burger was good, but huge.  The crab cakes were surprisingly good.   It was really the service that did them in, but to their credit the manager (or someone doing an imitation of a manger) came out to tell us that the food would be out some time.  Then we had to also wait on the bill, and to pay the bill, and so on...

If I had any suggestions, it would be for them to go on ""Kitchen Nightmares"" with Gordon Ramsay.  Not because the place isn't clean - it's immaculate.  But the size of the menu, coupled with the portion size, is insane.  Cut the menu in half (or quarters), and do the same with the portions.  They could even shave something off the price at the same time.

That way every person wouldn't be walking out with leftovers and they wouldn't have to spend so much time at every table trying to help diners navigate the menu.  Not to mention, there would be room for dessert.  You know, the cheesecake?",2009-11-04 13:14:14
k8vvFa4YUj15D3S5RQrxOg,N0-G-z_ZTgMx44GdHYad1w,L8rJht4Jw_BuR8gsckEWYg,3.0,3,0,0,"It pains me to write this review, because ordinarily, going to the Cheesecake Factory is such a treat! (We don't have one in Greensboro, NC). Sure, it's not ""fine dining"", but the food is always good and the portions are so large! With that said, my sister threw me a baby shower at this location on 2\/13\/16. They don't take reservations per se, but my sister was assured, 3 weeks ahead of time, that they would hold the back room open for our party of 25. My sister called the morning of the shower to make sure everything was still a go. This was around 10:45 am and she was notified that there was already a line of patrons outside the door. We hurried to the restaurant and arrived around 11:30 am and were told that the room and tables we were promised had already been taken!!

We decided to stay and wait, as invitations had been mailed out, and it was too late to change locations. Suffice it to say, we did not get seated until after 1 pm. This was difficult for me because I am 9 months pregnant and hadn't eaten because I never anticipated the wait. 

I ordered my favorite, Chicken Madeira, which was good as always, but the occasion was really ruined by the long wait.",2016-02-16 00:25:44
gMzYJ4PwfhwQ4D6qYF8JcQ,CtIBG55GolSXI3qjcQFExg,L8rJht4Jw_BuR8gsckEWYg,3.0,0,0,0,"Last night, I called and made reservations for today at 2pm to celebrate our son's end of middle school time. I was told to arrive at 2pm because the table would be given away at 2:10pm. Our party of four arrived at 1:45pm to learn the person who answered the phone did not record our reservation. The hostess was less than helpful and gave us a pager to wait like the other 25 parties there! Dissatisfied, I grabbed a manager who was gracious enough to rectify the situation. 

Our waitress was kind and pretty attentive. Our entree selections included shepherd's pie, shrimp scampi without tomatoes that arrived with tomatoes, kids' pizza and a Cuban sandwich. Everything tasted ok. If you do have the shrimp pasta, know that it comes with five shrimp, not many noodles and barely any ""sauce"". Oh and we did have a good appetizer, the buffalo blasts!

Known for their cheesecake selections, you can't go wrong. I have a caramel pecan turtle concoction waiting in the fridge for me now. It will make up for the beginning of our experience.",2017-06-09 23:17:46
dSF7ygUsPROZu1SpN-ueVw,OysN7UwSbJczdxck_Uv_Mg,L8rJht4Jw_BuR8gsckEWYg,4.0,1,0,0,"Great food.. Slow service, I mean really slow bordering on bad service. We went at lunch when the restaurant was not crowded .. I had the lunch Asian chicken lettuce tacos. They were fantastic. The twins ordered kid meals. The first was the chicken tender kids meal. One of the best kids meals I have seen. Highly recommended for kids. The second  kids meal was the burger sliders they were just ok. The kids fries are served in a silver bucket which the kids love. We had for dessert the Oreo cheesecake.. Safe choice for anyone. It was more than enough for one adult and 2 school aged kids.",2015-07-19 13:49:28
R_e9rVZUEy_fe0c-l7zcbw,gme4d_gCiAAnsGdIRAx7nA,L8rJht4Jw_BuR8gsckEWYg,3.0,0,0,0,"I've had Cheesecake Factory many times and each time I think the food is average. It's way overpriced for the quality served. Today I got the fish tacos, $15. The presentation looks great but the I could taste everything but the fish. The fish was unfortunately bland. I've had better for a lot cheaper at food trucks. I think everything on the menu is way overpriced and there are just way too many items to choose from. 

I think the cheesecakes are worth the money, they are delicious, but the actual food is really not. I'd enjoy the experience more if it wasn't so pricey. I usually don't dine here but a friend of mine wanted to for the cheesecake. 

The service is so so. Our waiter smelt of cigarettes which was a super buzz kill and really unappealing because we were about to eat. He came and went really quickly just to take our orders and serve the food but we never got a refill. We hardly saw him. I'd also like to mention that the floor is always slippery at every Cheesecake Factory I've ever been too and this one is no exception. Maybe it's the wax they use but they should reconsider this as it is prone to lead to accidents and injury. 

Probably would only come back for dessert but nothing else.",2017-06-30 23:54:02
UFcJHZST9ml2ARQSVIgW3g,LwvPZ1bQt5-Zl1xxPberVQ,L8rJht4Jw_BuR8gsckEWYg,5.0,0,1,0,"My one student wrote her review for YELP! Club about Cheesecake Factory, so this is actually Fiorella's review (6th grade student):

My experience at Cheesecake Factory was very delightful. The service was excellent because our server Angelo was kind and patient when we were ordering. The cleanliness was very good considering the amount of time the servers have to clean the table, since there are so many customers. The time we had to wait to be seated was understandable because Cheesecake Factory is always crowded. Overall my experience was very good. I would definitely recommend this restaurant to friends.",2014-02-12 14:48:39
cO0wNNHJLexrq2239FBG_A,5CgjjDAic2-FAvCtiHpytA,L8rJht4Jw_BuR8gsckEWYg,1.0,1,1,0,"Tried to place a Togo order and waited over 12 minutes and no one picked up when I was transferred. Called back again to see if someone can take my order and she said she didn't know if someone was in the bakery. I asked to speak to a manager and she put me on hold and I waited for over 5 mins. I hung up. I emailed a complaint but their website and I was told I would be contacted soon. Three days later no one contacted me. I emailed them again and I was called within an hour. I missed their call but they never left a message. I called right back and told whoever answered that I'm returning a call to a manager but don't know which one but it was for a complaint. He put me on hold and guess what....I waited another 10 mins and no one picked up!! Pathetic that I'm complaining about waiting and then have the same thing happened to me again. I called again and another guy answers and I tell him my issues and he says oh well a manager is standing to me right now. Oh ok, well why didn't they pick up?? Manager who answered was female and I told her my whole issue, she seemed like she wasn't paying attention because she paused for a long time and said that she wasn't working that day and didn't know what happened. Really???? That's the response I get? I asked why it took so long for a manager to get on the phone (10 mins) and she said it takes about 2-3 mins to get to the office to answer it. Ok, doesn't make any sense. I asked for the general manager and she said he would call me. He never called me but she called me and left me a voice mail asking to call back ASAP because she talked to the general manager and they want to try to get this resolved. Guess what? I called back within an hour and she went home. I left a message for whoever answered and she never called me back!! Horrible management. The GM emailed me a generic email apologizing. Crappy management and service.",2015-09-14 01:56:45
jPdatfv9cFSnaKxrDuaCFQ,t0HucSTxqwBU8SILnqgcAA,L8rJht4Jw_BuR8gsckEWYg,5.0,0,0,0,AMAZING FOOD! Me and my family went on Wednesday for some drinks at the bar at our server Bria was spot on! And I mean PERFECT! Even when I had a problem she fixed it quick and made it happen! Thanks so much Bria! We'll be back for some more cheesecake! :),2016-12-23 02:15:04
KQG-nIM_IMxzjRpLUVUKhw,S6XOGg1gJ-5iNWj0Au-zgw,L8rJht4Jw_BuR8gsckEWYg,1.0,1,0,0,"This  CF location has gone down in the last year or so. We have noticed several service issues, especially when dining in the bar area.  At our last outing, our server took almost 10 minutes to come to the table after we sat down to greet us, pass out menus and take drink orders. She was slow to bring drinks, didn't bring a side salad that was requested before the meal. The food was subpar, and they totally botched my order by giving me the wrong dish.  Everyone's food also arrived lukewarm, like it had been sitting for a while.

We did address it with the manager who was apologetic and discounted the bill. We were treating an out of town guest who had never been to CF before and were totally embarrassed that we had brought him here. We walked out thinking we should have gone somewhere else in the South Park area. Eating out is becoming more and more of a luxury and it is disappointing when you got out expecting a nice dining experience and  get bad service and bad food. We will not be returning to CF anytime soon and I can no longer recommend it.

UPDATED :10\/13\/14- After making a complaint on the the company website regarding the above visit, we were sent a $25 e Gift  card. We redeemed the card at brunch  about a week a ago and had a good meal and great service. We intentionally sat in the restaurant, not the bar area. I don't know if I would ever have meal service in the bar area again. IMHO the servers are better trained in the restaurant area than those that serve in the bar area.",2014-08-14 17:57:06
swIxrNMFkHlfCjNO4JK8Vw,3ZspXDft6Dq2AhJNYmAIIQ,L8rJht4Jw_BuR8gsckEWYg,4.0,0,0,0,"We've been coming here for years, and will continue too if they keep up this excellent service. There are times when it's absurdly crowded and waiting for an hour for a table. 

I've probably had the Herb Crushed Filet of Salmon over a few dozen times. Consistently good, what can I say. 

Avocado Egg Rolls for your app is a sure thing, ask for the ranch to dip with, believe me, it will change your outlook. 

Staff most of the time are tentative, occasionally there are times when service is slow, but that's expected with high volume locations. 

Most definite recommendation. The menu is overwhelming, and I'll need to try more to get a better understanding overall, but so far everything has enough taste to keep coming back.",2016-07-08 17:38:10
Vss8jpe1Vf3k28wC99SvsA,ndAYXLt22Yd4yTfosZlbPw,L8rJht4Jw_BuR8gsckEWYg,4.0,0,0,0,"I went here for my birthday last month and we went on a Tuesday night. There was 15 minute wait so don't expect to be seated immediately. The seating is also limited for those waiting. We got seated at a table that wasn't properly set up with plates and silverware. The lighting in the back is dim which I didn't enjoy. However, the service was excellent. My server helped me make a great choice for dinner. I got the fried cheese to start and the Alfredo with shrimp for dinner. Both were delicious! We got the Oreo cheesecake and it was so good.",2017-02-23 20:58:25
sIeBA82REMUNVHOCoNAydA,v-MSmR4gObTkdKiW-lp96A,L8rJht4Jw_BuR8gsckEWYg,2.0,2,0,1,"There really isn't much to say about a place like The Cheesecake Factory. It's chainey, has huge portions.... This particular location feels too large, like I felt like I was getting lost in my booth b\/c the place was so large. 

The food was on par with what I have come to expect from this chain, but it was the service that warrants the deduction in stars. Throughout our experience the service was fine- not particularly good, not particularly bad- but that all changed as we were getting ready to leave. 

I had asked for a box (b\/c the portions are just too large here) and was in the process of placing my leftovers into said box when the waitress came back after running our credit card. As I still had my hand on my plate, picking at the last few fries that did not fit in the box, she swopped in and took the plate from me. Really???? This took a middle of the road experience and turned it sour.",2012-02-10 14:40:38
dES0jIM1NrPOXHvglfPN6Q,ilgjs-SMCQCoW4WPmxyYww,L8rJht4Jw_BuR8gsckEWYg,1.0,0,0,0,"My daughter's birthday dinner was a disappointment. She requested going here because she remembered that when you order a cheesecake they write Happy Birthday and light a candle. I even checked on their website that they will do this. When we arrived I informed the hostess that it was my daughter's birthday. The server even said the birthday girl can order first. Everyone did enjoy the food even though it was way too much to eat. When the cheesecake arrived nothing was written on it and no candle! I quickly asked if they could write Happy Birthday and put candle on it. Then our server came back with the cheesecake and said ""Did you think I forgot about you?!"" Yes you did and she just stood there while we sang which was annoying. I then witnessed a young lady get a cake with writing and a candle plus several servers were singing?! I asked my husband to address the issue with the manager. The manager didn't seem to care. He was only concerned about us paying and leaving. Not good customer service at all!",2018-08-17 11:16:31
ibisRTEdG-2CPym0hc-cmA,i322TTjRYmDVRcmGibetdw,L8rJht4Jw_BuR8gsckEWYg,3.0,0,0,0,"If you are already at the mall, you should go to Cow Fish or another restaurant near by, but if you are set on the Cheesecake Factory.. The menu is giant so even the pickiest of your friends will be able to find something. Desserts are always good. The service is always sub-par and you should expect to wait over an hour on weekends just to get a table. We have tried getting takeout during the week and it still took a long time even when no one was there. The three workers at the dessert bar were talking in the back room or texting on their phones. I decreased my review after Cheesecake told me to try going in the morning or later in the evening. Cheesecake should work on hiring more employees or training them better.",2017-12-06 00:01:32
8z7KTR4t5VxZaWJV-irk7Q,33v8c5ftrKuDGTw1ZQ2toQ,L8rJht4Jw_BuR8gsckEWYg,3.0,0,0,0,"The menu at The Cheesecake Factory is somewhat overwhelming in it's size and breadth.  While it's a lot to take in, the menu also offers pretty much something for anyone so, it's a nice destination for a large group who can't agree on a particular genre of food for the night.

Definitely enjoy the avocado egg roll appetizer.  Fresh, ripe avocado mixed with some diced tomato, red onion...  They are quite good.  As far as their namesake dish, cheesecake, I'm not that big a fan.  Not much of a dessert fan but I do love a good slice of cheesecake and find the Factory's to be a little to fluffy in texture for my tastes.  I prefer something more dense.  They have a large the selection of flavors however and my wife swears by the ""Dulce de Leche"" version.

For a drink, if you're going non-alcoholic, I like their lemonade a lot.  Fresh and tart.  Definitely not Country Time!",2011-07-10 13:16:59
3tbZscCRLkkabCiP-2XfOw,NTyUzfyQQ3pBEpg7Gve6iA,L8rJht4Jw_BuR8gsckEWYg,5.0,0,0,0,"We always enjoy the food and atmosphere at The Cheesecake Factory. We're also happy we now have one in Greenville. The ""Skinnylicious"" menu is just right.",2016-10-03 16:43:36
iurm7KS_5uVlcGuROBNckQ,VKlzfFJUd6ANLktObH0BhA,L8rJht4Jw_BuR8gsckEWYg,5.0,1,0,0,"5 stars for the Cheesecake.  Would give it 6 if possible.  I mean REALLY!  I had a large group of folks(10) and thought we would jus tshow up and eat on a Sunday at 3 thinking everyone would be finished lunch.  A couple minutes before arrival we called just in case.  HAHAHAHa.  2 or 3 hour wait.  Not going to happen.  Will get the full dining experience there later.  We decided to go through the to go line and buy a slice.  We all got at least 1 at a big price(7.95).  Thought it was pricey until I saw how substantial it was.  We then took our slices to the food court and got lunch there.  I got the 30th Anniversary special cheesecake and it was so indulgent I can't tell you.  Ok, I'll tell you.  Chocolate cake layer, cheesecake layer, chunck of chocolate on top, great whip cream, beautiful crunchy tofffee-ish crust.Absolutely wonderful experience.  If you ever go here and too much of a wait, the food court at this mall is great and you can bring your to-go slice of cheesecake to devour after your lunch at one of the great other spots in the food court or if just eating cheesecake they won't kick you out.  Both are good options.  I now am on a mission to eat at this place and will one day but this experience was great and would recommend it for any dunce thinking they can get in on a beautiful Sunday where everyone and their mother is at the mall and most have eyes on this cheesecake heaven.  The wait line is relatively quick and worth it.  BTW.  Tok my piece after eating too much Chinese food home with me 200 miles and it was damn good the next day.  Really!",2016-04-26 13:59:49
-VRsKXZSsk6PoPr5KhfbwQ,OT3q21JZls-MV7Wv0d4bwQ,L8rJht4Jw_BuR8gsckEWYg,4.0,1,0,0,"Located in the South Park mall this is a busy area.  ONE MAJOR NOTE if you go on a weekend be prepared to wait they estimated 3 to 2 1\/2 hours on Saturday night!

The inside of this place is huge one of the biggest CKF I have ever been in. They are one of the better chain restaurants with one of the biggest menu's I ever seen.  It is pages upon pages of options.  

The food
They always start you off with some bread which is decent nothing specially but always fresh and warm which is key.  I ordered Shepards Pie yes you heard me right at CKF.  It is one of the best I have ever had.  It is my favorite comfort food and it is hard to find at most places.  It had great flavor and the portion was generous. 

Staff
Everyone was very friendly I have never had a bad experience at this place.  My waitress was helpful and attentive.  

Verdict
I am not a huge ""chain""  guy but CKF is one of the few I would go to if I am in the area.  The food is really good and the selection is second to none.",2015-03-09 14:06:55
hQ8KwfSX8FlSXA-BcY6CGw,Oovnv51Qp8-RKJ402-jHWA,L8rJht4Jw_BuR8gsckEWYg,1.0,0,0,0,"I have never liked the food at CC Factory but mostly the consistent bad service. Today just solidified it for me. We call ahead day before a large group, no reservations.  We show up and a two hour wait and we can't even sit together.  Forget that. We left for Cantina 1511 and they hooked us up!!",2017-11-11 17:28:10
SZxCrj_2Tg82WQ-s4XY5NA,zZYHZwmBl9Af4pI-aLXBFA,L8rJht4Jw_BuR8gsckEWYg,3.0,3,2,1,"Hi Cheesecake Factory I like you but I'm not in love with your crazy wait times, or giant sized portions. Your place looks pretty cool though, I like high ceilings, and I can appreciate the sizable outdoor patio area, but can we get tables that are a bit bigger please? It's really crowded!

Adjoined to Southpark Mall is the ubiquitous Cheesecake Factory. Every time I go for a shopping spree I see tons of people waiting their turn to get into this place like an exclusive nightclub and people leaving with bags of food. So I finally decided to try it out after a shopping spree one day. The place feels very cavernous walking in with super high ceilings and some paintings to gaze at as you're looking up wondering how much their power bill costs. Well then the waiting game begins, first we checked in to the hostess station and was told there will be about 45 minutes wait which turned out to be about an hour, okay no big deal I thought. Turns out the buzzer thing they gave me was to announce that I could now wait in the shorter line to actually be seated! What a tease!

So now we're finally seated and hungry looking at the huge menu. Some bread came out I guess to sate your hunger a bit from waiting an hour+ to get a seat. I ordered a frozen mango smoothie and appetizers took that took a while to come out by this time I'm wishing they gave me some more bread. The spicy ahi tempura roll that came out is huge and delicious but not spicy at all. Then came the main courses which actually came out on time! I had ordered the Cajun jambalaya pasta and was totally unprepared for the size of this thing. I mean seriously it would have taken 4 meals for me to finish this thing off, it was very delicious though! The sudden influx of food at once left me feeling really bloated though so we opted for taking dessert home and bought a tiramisu cheesecake for later.

I've probably rambled on too much at this point so I'll just summarize. Come prepared to be hungry in 1-2 hours and not while you're actually hungry. Prices are a bit high for the type of food but they give you enough food for 3-4 meals. I just don't really understand this place the food is nice but I there are plenty of dining options around this area where you don't have to wait for 2 hours. If they took reservations I'd probably be here more.",2011-06-08 20:46:28
0gBdf6pyVdTiXUy7qGOazA,kX-oTXuluTVcIcNVT4g3Pg,L8rJht4Jw_BuR8gsckEWYg,4.0,0,0,0,"The burrito and fried cauliflower was sooo  good! My husband sent his Jamican chicken back. It was not to his liking. However, he is Jamaican so he had high hopes lol.",2017-05-29 00:57:01
2zo5iX0rVqVQ2v-pmDDGWw,uKLPg9l1CJO_Mr0iVUSq3g,L8rJht4Jw_BuR8gsckEWYg,5.0,0,0,0,"A huge thank you to Jamie for accommodating my large party. I love his personality and he is an asset to your establishment. Also my server Courtney was wonderful, PATIENT, and constantly kept our glasses full.
The food was as expected (tasteful, large portions and fresh.) Our only problem was a salad containing beets and asparagus arrived without those items. The cooking staff should have informed the patron or the server of the issue. A manager did address it once the mistake was realized and informed us that they were out of beets.
As for the other meals, the food was hot and fresh. Well seasoned and the chicken is never dry. Their meatloaf is double the average serving you would receive in other places.  Most people will have enough for a box to go. Good food, good service.",2017-05-18 02:26:44
DnSEvUl3DHiar6qQc5lAsA,1xZV8pcpX66Ymb0r7ip-sQ,L8rJht4Jw_BuR8gsckEWYg,5.0,0,0,0,"Suggestions:

Be ready with your cheese cake order when your waitress takes your drink order as an appetizer.  Food takes a little while so don't skimp on appetizer s.

Tex Mex egg-rolls are a great appetizer

They have lots of other entries but I really like their hamburgers.  After the cheese cake and appetizer you don't want to be carrying your food to go.",2017-12-21 18:07:04
-G77bY05dUWgPJLLxdugzg,aTVdrtsaVYH48ISzBm0q5Q,L8rJht4Jw_BuR8gsckEWYg,4.0,0,0,0,"It's hard to review the Cheesecake Factory because honestly, if you can't find anything on the menu there's no hope. The food is good and the waiters are always very attentive when we go. Best time to go is on a week day during lunch time. Weekends get crowded which is very understandable for anything attached for a mall. But we always call ahead to see what the wait time is before showing up. Don't forget to stop by the cheesecake counter or get the eggroll sampler! It's a chain so my expectations are lower than a 5 star steakhouse.",2016-10-31 07:39:11
NuryXvRBZMODl2YpjM-tfQ,7LOXzDqBcmPFufRCfzQk1w,L8rJht4Jw_BuR8gsckEWYg,2.0,0,1,0,Whoever manages the lines for ordering cheesecake and the cash register needs to be fired.  The food is good but try running the business and managing expectations instead of pissing all your customers off.,2015-03-21 22:47:18
