review_id,user_id,business_id,stars,useful,funny,cool,text,date
xSoFBz-H1WqPQG7HXT50lg,vthSLGfTLGKkltEMQks9Pg,L8rJht4Jw_BuR8gsckEWYg,2.0,4,3,2,"I don't usually review chains but this was my 1st experience there & I was very disappointed.

First off,  the restaurant is very nice looking.  I liked the ambiance from my point of view in the lobby.  When we were seated... not as much.  We were tucked in this little alley off to the side of the bar that led to what I'm sure was a nicer room that looked out into the parking lot.  We couldn't see much from where we were sitting except the waiters running back and forth and the little area where they entered orders on the computer. 

But I'm jumping ahead... we got there a few minutes before 7 and had to wait 45 minutes for a table for 2.  Some people coming in after us were told up to an hour and a half! I know this because the pager\/beeper they give you is only active IN their lobby.  So there were about 50-70 people all standing around this lobby starring at each other and the cheesecake in the case.  Not cool.

Finally our beeper went off and then we were told to stand in a certain spot to wait for our name to be called. More waiting.  Then we were taken to our little alley table.

The menu is 21 pages long.  And then there is a Skinnylicious menu on top of that. Ridiculous.  We ordered the spinach and artichoke dip.  It was fine.  I've had better.

I ordered the Pasta Carbonara with Chicken.  It was OK. Again... I've had better.
Boyfriend got the Bistro Shrimp Pasta: Crispy Battered Shrimp, Fresh Mushrooms, Tomato and Arugula Tossed with Spaghettini and a Basil-Garlic-Lemon Cream Sauce
I didn't taste it but he said it was fine but nothing he would crave again later - and that he liked another pasta dish from another restaurant much better.
We each ordered a slice of cheesecake.  I got the Chocolate mouse cheesecake which I thought would be light and fluffy but no.  It was very heavy.

It was very expensive in my opinion.  We both got water, we shared an app, each had an entree and a piece of cheesecake and this came to $71 after tip.  For what we got? It was not worth it at all.   2 stars on Yelp means ""Meh. I've experienced better."" That is exactly right in this case.  We will most definitely not be back.",2012-11-18 00:22:54
SZnPjS1QVSoHS_V3tsh80Q,d8faaLHe6rJuYyZkM3Fx2Q,L8rJht4Jw_BuR8gsckEWYg,1.0,0,0,0,"I am VERY disappointed with my visit tonight. To start out I was told it would be a 45 minute wait, no big deal. I was expecting a long wait so that was fine. The problems began when We finally sat down (our party of 4) and  about 5 minutes went by, we were asked what we would like to drink (3 waters and a coke), the waitor took almost 10 minutes to get them to us. Then walked off 5 more minutes pass and we place our order (at 9:40 pm). The table beside us finished there meal, a new couple sat down. They ordered, there food was brought, they ate,paid there check and left. Still no food at our table. Finally at 11:00, two plates were brought to our table and about 5 minutes later the other two. The fries were so hard and old we didnt even eat them. When we finished eating I asked for the check, he asked if we wanted cheesecake, we all said no, he walked away, came back with a menu and said would yall like cheesecake. I politely said ""no, just my check"" he brought it then after what seemed like forever finally came back to take my card to run it. This was the worst experience I've ever had at a cheesecake factory.",2018-06-03 13:49:15
EK9oX81su0w-HnHWJl0fJQ,DYH2kUVBB327I21hK4Yviw,L8rJht4Jw_BuR8gsckEWYg,4.0,1,0,0,"I enjoy dining at many of The Cheesecake Factory locations. I have tried many different appetizers and entrees and have yet to be disappointed. My alcohol infused drink was quite tasty, my skinnyliciuos chicken tacos were fresh and flavorful, and the Chris Cheesecake was delicious! I will agree with some of the reviewer's that the wait can be long and tiresome on a Saturday night. But you have to consider the amount of patrons and the establishment is not that big. I wouldn't necessarily say it was not worth the wait. And as another poster mentioned ""Applebee's crowd"" that pretentious a-hole should take his business elsewhere. I read of a decent, good and kind hearted man who is known and loved by many to this day who never judged and would not judge people, his initials are J.C. Maybe some of you know him, doubt the pretentious poster does.",2014-12-28 17:13:55
-B705rVTncbRkNktV5RpVQ,Reuq65EOFI938Yg8xgff9g,L8rJht4Jw_BuR8gsckEWYg,3.0,0,0,0,"When you are in need of a slice of sweet sugary deliciousness, The Cheesecake Factory has got you covered. It's a staple ""nice restaurant"" sure to please even the pickiest of eaters...their menu is like a novel, granted half of it is full of advertisements. 

You can quickly turn to the lunch menu, page 8. The portions are plenty and will run you around $10, give or take. However, their regular beverages will run you a solid $4. A nice perk is that they serve their ""chocolate and vanilla"" bread (that's only how my friend's daughter describes it, not the flavor) anytime of day, whether you eat lunch or dinner. They do not have very many vegetarian options, but they do have a veggie burger filled with brown rice and beets. 

This location is prime...after a fun shopping spree at South Park, you can relish the day on their open patio! Service was attentive and friendly and the people working the host desk were all smiles. 

I don't go here often, but it's one of my mom's favorites and when nothing but cheesecake will suffice it is my go to place (a slice will cost you approximately $10). Like me and everyone else the day I was here, you'll leave full and happy with a ""to go"" bag in hand with a slice of deliciousness for later.",2012-03-18 20:49:47
V_S0nWuhMkB9r0sQO_hu-Q,NENv6V_OfYW-4qx_tQbcxQ,L8rJht4Jw_BuR8gsckEWYg,3.0,4,1,1,"OK, I went in with really high expectations from everything I've heard about this place. We went on a Friday night around 8 and only had about a 15-20 minute wait. We were seated and our waiter seemed very nice at first and told us to take our time and soak in everything. I was amazed at the menu, it had anything and everything you could possibly want and then some.  The fried Mac & Cheese balls were AMAZBALLS and our food was delicious. 
I was very disappointed with our service though, he started off great, and I don't know what happened, but it seemed like we were bothering him by sitting in his section. He treated the other two tables he was waiting on very different and was super friendly but any time he came to the table we had to request refills on drinks and he just never checked in at all. This was a huge disappointment because like I said I had super high expectations coming in.   

Bad Service aside, the Cheesecake is to DIE for!!!!! Oh My Goodness, My husband tried the original cheesecake, but I had to go all in. I got the Chris' Outrageous Cheesecake and let me tell you it did not disappoint.  It was a layer of brownie, topped with a coconut chocolate chip cheese cake, topped with chocolate cake, and if that wasn't fat enough it also had a coconut pecan frosting on it.  Yes it was a completely fat *ss item, but it was so worth it. I would stay on the elliptical all day to have that once a week. 

Overall it was an ok experience.  The food was AMAZING, but the service was very disappointing. :( I will definitely  give it another try and for sure at least get some cheesecake to go.",2015-09-07 02:46:01
vYXHqVqSqtWPwO7GuYGxQg,M1iMJ-j8utBDWNgpTfqBzA,L8rJht4Jw_BuR8gsckEWYg,4.0,0,0,1,"The Cheesecake Factory has to be one of my favorite chain restaurants that I'm not ashamed to admit I love going to. I'm not sure if it's the fancy cocktails or the ridiculously expansive menu followed by the most decadent cheesecake, but I always feel so fancy when I come here. 

This location is easy to find, but it's connected to Southpark mall so parking can be a bit of a nightmare. The inside is beautiful with cathedral ceilings, ample seating for dining, and a really nice bar area. I wish they had more seating for the waiting area because there is always a wait. If you're lucky, you can find seating at the bar and order your meal there as well.

I have a few staple favorites that are my go-to's when I come here. I love their four cheese pasta with chicken, the steak diane with salmon and potatoes, and their fried mac n cheese balls. The bread is delicious and unlimited as well. Their cocktails are also always delicious. My favorite cheesecake is the 30th anniversary with layers of cheesecake and chocolate cake topped off with ganache. NOM! I also love the regular topped with strawberries. 

I would recommend eating here for the experience, but just know you will have a wait and you will spend a pretty penny, but you will leave full and satisfied!",2018-06-30 17:03:17
2TbrO_Cfzkq5oBxZQhlbpw,fVAnbtesu95qmbSeolzcEQ,L8rJht4Jw_BuR8gsckEWYg,5.0,0,0,0,Nice and friendly Bartender.  Jeremy was Awesome and he was a cutie-patootie! Was patient for our order... And quick to check and make sure we were doing good and enjoying our experience.,2016-01-10 22:56:05
JEVFjsFfY0On3M3oqPqdNw,XJKI1vp8GuXQHcDAU4gUaQ,L8rJht4Jw_BuR8gsckEWYg,1.0,3,2,1,"Cold Crappy Food, Over and Over...

Why do I Torture myself every time.

The Manager is W E A K !!!

Kyle Davis  - Manager",2014-04-06 19:02:38
sdWo-GbOhGmH5DbXQYySuA,KN8aLwSN4irIgfJI4T1zQw,L8rJht4Jw_BuR8gsckEWYg,2.0,0,0,0,"So I think make my ""Monday Night"" an easy work week night and get take out from Cheesecake Factory. Boy was that a wrong call especially since this is their slowest night! So I complete and pay for my order by 8:01 and was quoted 20 to 25 mins and waited until 8:42 at which point I asked the same take out cashier who had rang me up what was going on she replies waiting on fries and I said well you told me 20 to 25 she replies back I said 25 to 30 I said no but let's go with that then what's taking an extra 15 by the time that banter is done she had no answer except would you like me to get a manager and I replied yes that and the food you said would be ready within the 30 minutes that's now 45 so I wait for him ( Adrian) I believe was his name and after watching him deal with another customer to whole he gave a free slice of cheesecake because I'm guessing resolving yet another dissatisfied customer I unleash a flurry of choice words on their lack of customer service and kitchen performance because 2 hamburgers and a couple of salads do not take 1 hr worth of prepping because the prep boy that came in at 6am already chopped everything up and it's a matter of putting it all in a box. Meanwhile I have a viewership because I have become irate over the lack of concern as the store manager I believe Brandon to be was just watching with a blank stare and I ask him what's he doing and he states just listening to you didn't want to interrupt so I said you'll have to cause I'm long winded. Had nothing to offer so I had him go chase for his business card so I can call corporate or at least email them with first hand insight to their Monday night standards and hope they can improve on it. See the things that makes me so mad, irate or just blow my lid is unlike most people that complain I wasn't looking for ""free"" anything as I always reject such option. That's a band aid on an open wound. What I want is for you to take the time and go look into the issue and fix it and not give me this blank stare like you are surprised to see a customer so upset over a couple of burgers taking an hr to be made. Are you freaking kidding me! I've seen junior chefs make complete meals in an hr and yours can sling out some burgers in 30 mins. Time for training session or new cooks. They're a dime a dozen I'm guessing since it's not a restaurant where you have the liberty to make your menu as you go. Hope this helps you Brandon with what the issue was and you jump on it and get it taken care of. I know it's not the first time service has been lack luster and that's putting it mildly! And to all the staff just being a spectator on the conversation it makes sense why your operation was lacking and why the customer before me got a free dessert from you!",2017-04-04 01:36:46
j8Kbux2GZRUm6ZTM48J4QQ,JqEHyGNJRROQyhKPKHsrFg,L8rJht4Jw_BuR8gsckEWYg,2.0,0,0,0,"I would have definitely gave five stars but this time we got the express service! The drink and appetizers were served 3 minutes after we sat down. We were interrupted every minute by the waitress who rely wanted to know if we have enjoyed out Factory Nachos!!! Really? She introduced the desert menu before even we finished our drink!!! Lol 
We have always had great service but not today....  I'm putting one star to my review just maybe to get their attention and work with their employees to better serve customers.  Food is always great their and tiramisu for desert with coffee is always the best endings. 
I will keep going their with my family. 
Food and drinks deserve 7 stars.",2015-01-09 00:00:36
iR-tLb7H7jelp9GGaYafDw,TWQ4bxTnfz40cZMFCE2W-g,L8rJht4Jw_BuR8gsckEWYg,1.0,2,0,1,"Literally one of the worst Cheesecake experiences I have ever had in America or abroad. You expect consistency and at least passable quality when going to a chain establishment, but not the case here at this location. Wednesday night last week stopped in for a late dinner (9PM) after a long day. The server was great very attentive, but unfortunately the same couldn't be said about the kitchen. Ordered Thai Lettuce Wraps  and my friend ordered a burger - one hour in an empty restaurant to grill some chicken - and plate it with lettuce. Kind of crazy, no apology from the waiter on the wait. 

Food finally came out - there were three chicken pieces on the plate - 3 about the size of two of my fingers side by side. - $14 for that? Sauce was missing from the plate and the lettuce was rotting. I wish I would have stopped to talk to a manager, but after a long day all I wanted was to eat and go home especially after an hour wait in a basically empty restaurant. 

I really hope this location gets it together, because this experience has a previously loyal customer questioning future visits.",2017-11-22 04:32:16
WuFi1Nk2xDA1u9bVvyvm0Q,aoxkyYZzCucAmkDKNL1fCg,L8rJht4Jw_BuR8gsckEWYg,1.0,1,0,0,Horrible experience waited 70 min for a table then waited an additional 50 min for a child's spaghetti and meatball dinner and the adult meals sat under a warmer and dried out. Ordered a cheese cake for desert and was told the bakery staff were on a change of shift and waited over 20 minutes for a desert!  I can not recommend this place due to slow poor service.,2016-12-10 22:22:57
Z4uzCzsR6-389wZit5aobg,_Wiq1GSIjoOx3S3KtRTBtg,L8rJht4Jw_BuR8gsckEWYg,4.0,0,0,0,Went back to try Cheesecake Factory again. I must say our visit this time was very good. Our server Alex was excellent and the food was just as good. Even being a busy Saturday our food did not take long at all after placing our order.,2016-09-25 18:39:23
2jeUpIW27jwPvS5pSFJOxQ,P14bqC_Ynbp8O3tLePRKSw,L8rJht4Jw_BuR8gsckEWYg,4.0,2,0,1,The service was spotty.   We were sat and waited 15 minutes before a hostess was flagged by me.  Then the mgr came and offered apologies and free dessert to each of us.  The food was very good.  The fried catfish was a hit and the tuscan chicken was just in need of a little salt.  The chocolate cakes were delish and the lemon cello,2016-07-19 22:45:25
ZtZO9NbaPSSkkhtXczl0Fw,6Tq8nERSf_JqTE1H09TmjQ,L8rJht4Jw_BuR8gsckEWYg,3.0,0,0,0,"I went with my sister for lunch on a Saturday.  We got there about 10 minutes after they opened so we didn't have the wait other people have complianed about.  They seated us at a two top bench seat in the bar area. At first this seemed fine but 10  minutes later the hostess started setting up the table next to us (the tables were about 12 inches apart) with 2 highchairs and a booster seat then seated 2 couples with 3 small children. They were not happy being squeezed into a bench seat with the highchairs etc. but even after they complained to the waitress and the hostess, the hostess seemed unable to come up with a solution.  Seems they could have just moved them to a table where they could move the chairs to accomodate the highchairs.  The menu is overwhelming.  I'm always a little suspicious of a menu with so many items.  I feel like more often than not, everything just ends up being okay and nothing is really good.  My sister ended up getting the burrito and I got the bbq chicken salad.  The burrito was the biggest portion of food I've ever seen in a restaurant.  It could have easily fed 4 adults.  I could only eat about 1\/3 of the salad and it was the lunch portion.  The food was good, not great.  The service was good.  I would go again but would request a table, not a bench seat.",2011-01-23 15:13:55
4hIlK6DJfi12CVipryRHEA,ku4Xcb-4msmAoAgGaDIIbQ,L8rJht4Jw_BuR8gsckEWYg,4.0,0,1,0,About to get the Chocolate Godiva it's hotter then lady GA Ga and looks bueatiful like the candy,2018-06-14 20:21:42
WqFCF5C4OG43DCZhNPNqDw,wIi4TiaMutazLCsD8cFNow,L8rJht4Jw_BuR8gsckEWYg,4.0,1,0,0,Always love the Cheesecake Factory. This particular location ALWAYS has at least a 45-60 min wait. Food is always great.,2015-06-27 20:01:25
37wLLkmcKCGH8Hy7FXou-w,zox0bzk1LvmLb77fmcRjUQ,L8rJht4Jw_BuR8gsckEWYg,4.0,1,0,0,"I stopped in here for the national cheesecake date 1\/2 special. I've been to various Cheesecake Factory's all over and this one was no different - delicious cheesecake. Despite be very busy due to the promotion, the line moved quickly and efficiently. I'll definitely return for cheesecake.",2017-08-04 18:55:40
2510uof0G_1NRHMsuqsESg,tERVCyYN3Nujk6JEyd2JZQ,L8rJht4Jw_BuR8gsckEWYg,4.0,0,0,0,"The service was great; our server called us 'princess' which was cute. I wasn't too hungry so I ordered from the 'Small Plates' menu,the Greek Salad and Chicken Samosas. I loved the salad and the Samosas were nice and spicy.",2015-06-26 08:01:46
2yk5k3xuIks54UObILRhgw,I2_0QKpOziKk2Fo482jQCw,L8rJht4Jw_BuR8gsckEWYg,4.0,0,0,0,"We were going to be in the area and my wife wanted to eat here. Wow, what a beautiful Resturant. We took the advice of another Yelper and ate dinner at another restaurant and stopped by for desert. It was around 2:00, and were seated immediately. As stated in another review the wait staff was indeed ""stuffy"", but that's ok. The Resturant decor is beautiful. We both had a drink,mixed to perfection. I decided to have the Ahi tuna Tatar appetizer, and we split a slice of 30th anniversary pie. The tuna was 1-3\/4"" of avocado with 4 pieces of tuna, no bigger then the end of my little finger, on top. But that's ok. The Resturant is beautiful. The pie was the real hit, and was enjoyed to the last crumb. The bill for two drinks, 1 appetizer, and 1 slice of pie $38. When we left the Resturant we both busted out laughing. We couldn't imaging what the bill would have been if we had eaten lunch. By the way a slice of pie is just under $9.00. A whole pie is $$50.00. Again the Resturant decor is beautiful.",2016-01-08 14:10:00
k3qK0SpX2BeTXSK6uNyWRg,YEB_aZxPU3iJA0iB1Zd4sA,L8rJht4Jw_BuR8gsckEWYg,4.0,0,0,1,I'm always ready for cheesecake! Mushroom burger never disappointed me my gf got four cheese pasta was delicious! John served us and he was very nice and fast! Love this place.,2017-12-23 02:26:45
RHoypbPtl7HnRJFxYtnsMg,rQS1yrhDuICBLVgBsICMnA,L8rJht4Jw_BuR8gsckEWYg,1.0,0,0,0,"We came here to celebrate a birthday. The wait time was 10 minutes on a Sunday evening.... arriving at 5:45. It was 20 minutes and parties of a similar size who checked in after were sat first. Our booth was past the bar area and the seats were covered in crumbs. We had no silverware when we were sat but it did come with the bread. Our service was ok...she was nice. Her timing was off but considering waiting tables while pregnant is a challenge....she did ok. Our food arrived fine but we had ordered chicken OTS with the four cheese pasta and it arrived 20 minutes after the entrees and it was bland. I asked for a manager to bring this kitchen issue to his attention, he never showed up. When the server who dropped off our food didn't have the chicken with him, he confirmed we were missing it but it was 20 minutes for it to arrive. We had finished eating by then. We did dessert to-go. Not sure we will return to this location.",2016-09-25 23:31:45
cwUFBca8ZtzpDlLupUWsvg,azkRd9DrWo53-seEECDb_Q,L8rJht4Jw_BuR8gsckEWYg,1.0,0,0,0,"Very disappointed in Cheesecake Factory, tried it a few times bc of friends wanting to eat there. And it's all been the same, I am not hard to please whatsoever but I would of rather gone to Dairy Queen to get a meal and dessert. Money doesnt matter to me but quality of a meal does the last experience will be my last one. Went there with a date ordered two appetizers calamari was perfect but the crab bites was horrible. Ordered two alcoholic drinks one of which was a mint mojito never had anyone butchered the drink that much it was awful. After waiting an hour after finishing our appetizers our food still wasn't out yet nor was the server anywhere to be found, it being not busy and also a Monday night we didnt understand why it was taking so long, finally the manager came over and told us that our food was accidentally sent to another table, understandable we was patient and said its ok 10 mins later someone other than the server brought the food over to our table and it was not what we ordered. Not touching the food we waited a while til the server came to check on us told her the issue she took the plates away and returned with our order, I'm guessing my food was sitting under the warmer in the kitchen for a while bc my steak Dianne was over cooked and dry when I ordered it rare, and the salmon was fishy and cold. The only thing that was truly acceptable was the cheese cake I guess if they messed that up they shouldn't be called the cheese cake factory! I will not be returning anytime soon and I won't be recomending it to anyone considering it was 120 bucks for two people and the food was awful like the service!",2013-04-19 00:15:55
VNCSDWSmWHAOUtlPhtlT6g,BCWT4_zhDpwlAonynyT42g,L8rJht4Jw_BuR8gsckEWYg,3.0,0,0,0,Love Cheesecake Factory food but a 2 hour wait on the weekend is too much!,2017-08-20 02:05:25
57rv172hV8kxLIF9J0VqxQ,rj10hcbfLHAF7SB9CXEkRA,L8rJht4Jw_BuR8gsckEWYg,5.0,0,0,0,You can not go wrong with the Cheesecake Factory!!  They have the largest menu of any restaurant I've ever seen.  Great meals and usually quite large.  I love the Thai Lettuce Wraps and the Orange Chicken entree.  Also the Red Velvet Cheesecake is out of this world!!,2013-06-09 04:54:25
CYJsFe1YXu1mpEw7zJqxpQ,AZ22WQRVsLl253-sz4_RYA,L8rJht4Jw_BuR8gsckEWYg,4.0,0,0,0,"If you're dining at the cheesecake factory as a party of one or two, they will often try to stick you in one of their tiny, little tables. You literally sit five inches from the guests beside of you. This may not be a problem for some, but I always make sure to ask for a booth to avoid these tables. This place has a HUGE menu. I don't think you can go wrong with what you choose, though. My favorite dish is the shepherds pie. It's a huge portion and so delicious. I like that, during lunchtime, you can get the half portion. I usually still end up taking some home! If you're not starving, I recommend getting the cuban rolls, which are an appetizer. I enjoy the cuban sandwich, but actually love these even more. They're so crispy and come with a great dipping sauce. Oh, and the cheesecake is a must- duh. Even if you have to take it to-go. I've had so many of their cheesecakes and just can't choose a favorite. You seriously cannot go wrong! Try this place next time you are in the Southpark area!",2015-02-10 03:58:19
YBS3Up6xaRMWvSLQIFz-iw,Zg1AY0S5Q5wdeafBDJPtcw,L8rJht4Jw_BuR8gsckEWYg,1.0,0,0,0,"Had a horrible experience here tonight-12\/27 around 7 pm.  My youngest son's food did not arrive until we had almost completed eating our meals.  The waiter, Blue had said they overcooked my son's cheeses teak (without onions or mushrooms ). No visit by the manager and our food took 30 minutes to arrive anyhow!  Food quality is dropping rapidly too;  I ordered the chicken Maderia.  It came with two asparagus. Three weeks ago there were at least eight. We will not return to this location.  Also, the health inspection score is low at 94.5.  Never again!",2015-12-28 04:14:37
RjmYJ0y3gMUV61XyJ0MtEA,uK8SyHQHcKItc4nSA3AslQ,L8rJht4Jw_BuR8gsckEWYg,1.0,2,1,0,"Went here for cheesecake after dining at Roosters access the street (which is phenomenal btw!). This was my first and last time visiting cheesecake factory. I ordered the vanilla bean cheesecake which was mediocre. The cheesecake came with more whipped cream than there was cheesecake. The worst thing, I asked the waiter if they could drizzle a little strawberry drizzle over the top and he said sure no problem. He brought out a small dish of what appeared to be gelatinous strawberry filling that couldn't have been drizzled if you tried. Absolute fail! Oh and I almost forgot, it took TWENTY MINUTES for an order of cheesecake only... We didn't even order food!!!!",2018-01-14 12:26:47
oIJ70jDIb7yCoCY96Dbsfg,nG2rWTrHxmjlCAjw53JM3Q,L8rJht4Jw_BuR8gsckEWYg,2.0,0,0,0,"This location is absolutely terrible. My boyfriend and I went on a Wednesday afternoon and we still had to wait about an hour for a table. The food was a complete disappointment.  Our server was the nicest part of the entire experience. Overall, I do not recommend it. I suggest going to maggianos instead.",2015-12-31 03:31:31
