review_id,user_id,business_id,stars,useful,funny,cool,text,date
cHN8XIB0yxhlPLQu-N9PdQ,kuDmRGcvJhFCHEXTNH1d4Q,L8rJht4Jw_BuR8gsckEWYg,4.0,4,3,2,"So a friend and myself stopped by the CF the day after Christmas for some preconsumerism consumption and were greeted by a friendly hostess, who seated us immediately.. It was pretty close to lunch time and they had ample seating for the lunch rush.  I recommend highly the avocado rolls for the appetizer!  OMgosh... Delisious-ness abound!!!  For the main meal I had a veggie sammich, which was great, great great!  Loaded with eggplant and mushrooms and other yum yums.  
It was plenty of food for the both of us with sandwiches and the app. for around 40 bucks, so it's moderate in the price scale.  I hear their namesakes desserts are good and do look well, but milk, and creams don't bode well with the ole system, if ya catch my drift!
One downer of the meal, was that the strip on my debit card is worn and the waiter had to manually type it, but when he came to the table he told me that it was declined, which was embarrassing, but then handed me the merchant copy to sign??!?!  I dunno what that was all about, but poor choice of words, waiter!",2011-01-01 23:35:41
PUXhYhaEsuqHLpLWE9j-5Q,miK8F-pvni8kq2GBp3ZcNw,L8rJht4Jw_BuR8gsckEWYg,2.0,0,0,0,"This used to be my favorite restaurant, but my experience today has been awful. The food was horrible and the waitress messed up most of my family's orders. The food was burnt or had something wrong. The wait felt like ages. Don't come here and expect the best.",2018-06-16 20:59:51
wB74rrfyzwGIjPeEdnCNyQ,ODYOwnJv279f-UvNmeE6rQ,L8rJht4Jw_BuR8gsckEWYg,5.0,0,1,0,"Love,love love great place to eat at obviously, because it never fails always crowded.  But other than that the food is spectacular, the staff are friendly and seems to be un bother by the pack house, which indicates they very professional and use to it and able to handle it. Food melts in your mouth my go to place when I just need some good, good food.",2015-05-05 21:15:13
Ct_lBjVeo-LREBgp-r8q_w,DaUJvHMmKoDDT3vB_ltJ6g,L8rJht4Jw_BuR8gsckEWYg,5.0,1,0,1,I never order entree\/etc at the Cheesecake Factory. Only cheesecakes.  I usually get waited on quickly and don't wait too long for my cheesecakes.  I haven't had a bad cheesecake yet.,2017-07-16 04:53:02
ZwEfUHKWyR98xIfViCPm9w,UE00YNur7t8h5CZzZemJAQ,L8rJht4Jw_BuR8gsckEWYg,5.0,0,0,0,I just had the best experience here. They were able to accommodate my special diet due to a genetic disorder. Eating out was always bland for me because I had to get just veggies etc. But today the people here were able to cook my low protein noodles and add a DELICIOUS marinara sauce. I felt so normal for once. Thank you Cheesecake factory! I will definitely visit again.,2017-06-14 00:43:34
ye_pLBEj5Q2UXWEyDi6a5A,nG2rWTrHxmjlCAjw53JM3Q,L8rJht4Jw_BuR8gsckEWYg,2.0,0,0,0,"This location is absolutely terrible. My boyfriend and I went on a Wednesday afternoon and we still had to wait about an hour for a table. The food was a disappointment. Our server was the nicest part of the entire experience. Overall, I do not recommend it. I suggest going to maggianos instead.",2015-12-30 22:13:02
qJhvJj_A_JakjjPELsBL2g,33dAdbBE0ysDWz9zs7XVsQ,L8rJht4Jw_BuR8gsckEWYg,2.0,0,0,0,"How many times has this location served bang bang shrimp with only 6 pieces of shrimp. Forget that they have diverse menu n decent service so we end up there after the mall.
Long story short, frozen n chewy shrimp the last few times I have eaten there. Today this happened again. If you can't afford the dish with good quality meat\/ shrimp then please take it off your menu rather than serving stale n expired frozen shrimp in your food. Customers have other choices. One or two bad experiences can be excused but not repeatedly. That shows your food quality standards have fallen.",2014-09-18 18:55:27
sJE6ITxZ9CiN7t-5PzKZ2A,At1-t5BZO5KRZz4GSYn7jQ,L8rJht4Jw_BuR8gsckEWYg,5.0,0,0,0,Sunday brunch was perfect! Had the Belgian waffle and chicken delicious. Of course the cheesecake never fails and the server was prompt and knew the job.,2016-05-30 01:22:09
WOAKatj_xovgnn7bifJZ6w,3Ue5-pkJPzlGNXtbIYBWNw,L8rJht4Jw_BuR8gsckEWYg,1.0,0,0,0,"It was our anniversary and we wanted to celebrate.  We don't eat out a lot.  We chose this restaurant for the dessert.  We have always enjoyed The Cheesecake Factory in Rockville, MD.  The cheesecake is fresh and beautifully decorated.  They use the best ingredients and eating this dessert makes you feel decadent and special.  We were expecting the same from The Cheesecake Factory in South Park.  It didn't come close.  The dessert was stale and tasted as if they had make it from a box mix.   I don't mind paying $10.00 for a slice of cheesecake if it's baked by hand from scratch.  This was neither.  I am afraid that success has ruined this particular restaurant and I won't be going there again.",2015-02-11 15:21:02
CNZtbtgOMgRrTisgsZAb7g,rIx2KbRcaj4_-4oQXgiNdw,L8rJht4Jw_BuR8gsckEWYg,1.0,0,0,0,"This place has gone down hill.  The food took forever 20 minutes for our appetizer and 50 minutes for entrees. The bartender Roland said the kitchen was busy and that is how long food usually takes because the cooks can't keep up.  He kept making excuses in so many words he said they are just bad at their jobs and that the kitchen isn't as good as it used to be.  He also said they had new kitchen managers.  I think he forgot to ring out food in.  Roland did give us 2 free drinks to make up for it. No manager came to apologize or offer any compensation for the long wait.  He also seemed drunk and kept going to the restroom.  Also overheard\/saw a server throw a temper tantrum at the computer.  Cursing and throwing a book  about a bad tip he got.  The server is a heavy set older gentlemen with grey hair,  glasses. I think they told his name was Craig.

The food is just bad.  I got the Scampi. I guess the recipe changed because the dish didn't have garlic or basil.  Pasta was overcooked.  No flavor at all. Steak Diane was also a disappointment.  No more pepper crust?? No flavor.  I had jerky that was more tender then the meat we were served. Our burger was also over cooked. It appears the kitchen can only cook well done or more well done.  I've had a better burger at McDonald's.  The chefshould be fired or at least learn how to cook.  We told Roland he said a manger would come by but after waiting 20 minutes we just paid our tab and left.  

We were going to get cheesecake but we saw some of the staff handling cheesecake with their hands.  Literally took the slice of cake out of the display and put it on a plate with just their hand.  No spatula.  At least they had a 1 glove on.  

There is a lack of institutional control.",2018-06-26 15:28:34
neIFLMM3m_vAUvIoXimGag,VASWUnbR4oAzlWsGUV4UwQ,L8rJht4Jw_BuR8gsckEWYg,1.0,0,0,0,"We ate here today, unfortunately.  The food took forever and a day to arrive.  When it finally did arrive it obviously had been living under a heat lamp for most of the time we waited.  I'm surprised it didn't have mold on it.  My wife ordered the ham and cheese omelet.  The cheese was cooked to a crisp...it resembled peanut brittle.  She actually sent it back because it was nasty.  The waitress agreed it was overcooked and placed an order for another one.  The second one took so long we just cancelled our order.  In the time we waited I asked for a water more than three times.  When we left one of my kids left a bag under the chair with a toy in it.  We returned a few minutes later and my wife asked a waiter if he had seen the bag.  He said ""we already threw it in the trash and threw the trash in the dumpster.""  Assuming the guy just didn't want to look for it she said ""so you can't get it back?"" He said ""what do you want me to do, go dumpster diving?""  Besides the fact the waiter was a complete jerk I'm shocked they managed to empty the trash 100x faster than they could deliver the food we ordered.  I will not be going back to the Cheesecake Factory!  Unbelievably bad experience.",2017-08-13 20:34:41
BlJ6Opt_JUFzJf_aYG3LFQ,H5kjbtCQH1eKyWdTaspmzg,L8rJht4Jw_BuR8gsckEWYg,4.0,1,0,0,"Me and my family visited The Cheesecake Factory for the first time tonight and was pleasantly surprised.  First off, we are not from Charlotte and we do not have a Cheesecake factory near our house.  We are Big Bang Theory super fans so when we saw it we knew we had to try it.   If you are like us and have never been or saw one other than on the show, then you will be in for a big surprise too!  

Atmosphere:  We arrived around 8:30pm on a Sunday night.  The wait was minimal even though it was pretty busy.  We requested outside seating since it was a perfect night for it, and were escorted right out.  Tables were nice, and had a small candle on it for a nice little touch.  The building the restaurant is located in is very nice as well.  Very upscale looking and a classy place overall.  Much different vibe and style than was in the show.  ( Hang with me through the BBT show comments, I am sure others are wondering the same as we were. )  8\/10

Menu and Price Point:  As most others have mentioned the menu is very very extensive.  You would be really hard pressed to not find something that you like.  Very detailed which I like because I am a picky eater, and nicely laid out considering the size of the menu.  As for price, I got the Penne, My wife got the Chicken and Biscuits (think chicken pot pie), and my daughter just wanted cheese sticks.  We also got 1 piece of the Oreo Dream cheesecake and the total bill was 53.00 and some change.  Not too bad considering the portions are huge and the food was very tasty.  7\/10

Service:  When we first walked in the greeter was not super friendly like most places of that caliber but, when we were seated things changed.  Our waiter was extremely nice and super helpful.  He was very attentive despite being pretty busy, and took the time to talk to us and offer suggestions.  He even addressed my daughter who is 10, which most of the time wait staff just look at us for her order.  I liked that and i think she did too.  8\/10

Food:  The food was very good.  Like i mentioned above my daughter got an appetizer for her main meal which was the Cheesesticks.  She liked them and even made the comment she wished there was more.  On a couple they were overcooked a little but she didnt complain and just peeled off the coating.  My wife had the Chicken and Biscuits and she really enjoyed it and gives it a 8\/10.  She could only eat about half a quarter of it due to the sheer amount she was given.  I got the Penne Pasta, and it was cooked perfect for me.  It was a little short on sauce but really was very tasty.  I did add a little salt, and I asked the waiter for some Parmesan cheese and he brought out a block and grated some fresh for me right at the table.  Im a big guy and I couldn't eat it all due to the portion size.  8\/10 for me on the pasta.  

I will definitely be back for me on my next visit.  

P.S.... Haven't tried the cheesecake yet but its a massive slice.",2013-07-29 02:58:19
fkYrWGh0CVU1ugcrXsh7xA,xNVe1zldH_184KeP1G43Og,L8rJht4Jw_BuR8gsckEWYg,4.0,0,0,0,Had a great lunch. A little pricey but worth it. The food was good and so was the service. Highly recommend.,2018-04-11 20:00:06
PTMiyF4Ag3zd8bKENd9rcQ,pfywH-FuqR7FY2mTSy25UQ,L8rJht4Jw_BuR8gsckEWYg,1.0,0,0,0,"Terrible. Nuff said. Horrible service, horrible food. Shocking because The Cheesecake Factory is one of my favorite go to spots. Never again in NC! Happy to be back in Phoenix.",2017-07-18 16:10:19
htdSXquEmgFuafeI4-DGXA,NTyUzfyQQ3pBEpg7Gve6iA,L8rJht4Jw_BuR8gsckEWYg,5.0,0,0,0,Every trip we make to Charlotte we try to eat at the Cheesecake Factory. We find the food well prepared and portioned just right. I particularly enjoy the meatloaf and the fish & chips.,2015-04-14 16:57:00
6TScbdJEThIXdVg9x28Zmg,4ck4N2HsXDnGpcuYsGeh6A,L8rJht4Jw_BuR8gsckEWYg,4.0,0,0,0,"We came here for my man's birthday and wait was 1 1\/2 hrs on a Saturday note, not bad. We tried the eggroll sampler, Cajun pasta, and chicken Madeira. The dishes were tasty, and healthier than we remembered.  Cheesecake was delicious, vanilla bean and Chris's outrageous. It's pricey but worth it for a nice evening.",2018-04-25 00:59:48
So8mMggg5erFpnSEdBGH2g,mx9n-xAk3tsaBzMDShXVaQ,L8rJht4Jw_BuR8gsckEWYg,5.0,0,0,0,The food here is always amazing. The variety is one of the best things about the menu. The only drawback is no reservations and you can end up waiting a long time at peak hours on the weekends. Cheesecake selection is great and will make the end of the meal special.,2017-07-03 19:54:24
aZsaby4AdU4Y_5fgpIRHmw,RM9go7F6JwbBWP2FP1dhuQ,L8rJht4Jw_BuR8gsckEWYg,4.0,0,0,0,"Cheesecake Factory is one of those places I found very late in the game. I'm from Connecticut, so there wasn't one near me until about 2016. So when I moved to Charlotte, it has quickly become reliable for a few things: crab bites, and Jamaican Pepper shrimp. This go round I had the lunch special, spicy Cesar salad and grilled Brussels sprouts and it was really good. In addition, the drink, was extra good, also a summer special. It had tiki in the name which was really cute.",2018-08-30 07:54:38
rpg9wBm7fuPo8ZT_e-pbHw,ovFBhEt28yMjW6hBBHp_gA,L8rJht4Jw_BuR8gsckEWYg,4.0,1,1,0,"Mmmmmm.... Ok so with the Cheesecake factory, there are some pros and some cons. 
Bad news first:
Cons: You will wait. Awhile. For a Table. They are always packed. Its a popular destination. The food is OKAY. I mean its called the Cheesecake factory not the Food factory. 

Pros: You can peruse the menu at your leisure while you wait. Its posted outside. Dim lighting...I love me some romantic mood lighting on dates. My dish of choice is the Louisiana chicken. The chicken is fried to perfection and the pasta is delightful. They serve you bread when you are seated which is warm and delicious. The cheesecake. OMG the cheesecake. I haven't had one I didn't like. They have any kind you can think of. My favorites are the White Chocolate Raspberry Truffle and the Banana Cream. Ok now my mouth is watering.",2017-01-24 21:03:31
3LnKYxVzUfWhBC7E535OTg,5uLeCZcoZYQS9AMTDwHpmA,L8rJht4Jw_BuR8gsckEWYg,5.0,0,0,0,I took my two boys here for lunch and and we were completely satisfied with everything we ordered. My two boys ages 12 and 10 were treated like young adults. I can't wait until we can eat there again.,2011-05-20 10:37:13
tJY5UY1_HIsgJs1s9IYkYw,CewenXlVI9qnxRLKzMPvBA,L8rJht4Jw_BuR8gsckEWYg,5.0,0,0,0,"I have been wanting to go here forever. It was well worth the wait and everything I hoped it would be. Awesome waiter, the food was incredible, and not overly pricy for all you get. To end the meal we got a red velvet cheesecake. We told the waiter when we first for there that we were celebrating our anniversary.  When he brought the cheesecake it had happy anniversary written in chocolate sauce on the plate. Totally awesome!",2018-05-27 15:06:18
jeoApOXUIGdPeHgNdD6rqQ,LMA_OHOJ8H7rhkS_7i8cXA,L8rJht4Jw_BuR8gsckEWYg,4.0,0,0,0,This place was okay for a Cheesecake Factory and I have been to several.  I had the chicken and biscuits and the chocolate mousse cheesecake. The chicken and biscuits was like a chicken pot pie with a buttermilk biscuit.,2014-11-20 23:20:54
K5QA8cpTMM2WQgVAaZWbwg,4XPvkq6mJWFYYHl5V2iinA,L8rJht4Jw_BuR8gsckEWYg,3.0,0,0,0,"I  prefer non- chain restaurants and haven't been to the Cheesecake Factory in six years, but amazingly the same menu items that I chose then were still on the menu. I got a Caesar salad with fried chicken and hubby got a buffalo burger ! Colleagues got a pasta dish, salmon dish, and chicken dish and all plates were consumed happily. Since we are all away from home we splurged on cheesecake too! TCF is typical and reliable. See you in another six years.",2014-06-24 02:57:52
PBO2Q1efrOs8hdIjAewXVA,5CgjjDAic2-FAvCtiHpytA,L8rJht4Jw_BuR8gsckEWYg,3.0,2,0,1,Had better service recently but I also didn't get a to go order. Came for lunch on a weekend and they weren't that busy. We gave the hostess our name and she told us to move to the side and we will be called very shortly. She made it seem like it wasn't gonna be long. She also didn't give us a buzzer. We ended up waiting a bit before we were called. Our server was friendly and greeted us quickly. I got the egg roll sampler. It was good but definitely not worth $12 for 4 egg rolls cut in half. My sister in law the the chicken and biscuits and she liked it. My husband got the salmon and thought it was ok. We got a few cheesecakes to go and went on our way.,2016-08-23 01:50:51
3UOCrNAQAeXumAoyBCJJ6A,xEupSNbB6H8fomOjK65fgA,L8rJht4Jw_BuR8gsckEWYg,5.0,0,0,0,"Visit date 7\/30\/17- that's the day they had cheesecake 50% off. The lines where crazy,  with 1 hour and 1\/2  wait after your order your cheesecake. It was so busy with no standing space. A lot of ppl was waiting outside. I had the celebration cheesecake AND IT WAS SOOOOOOOOO GOOD, it's made with cake and cheesecake I WOULD WAIT AGAIN FOR 2 hours!! That's how good this cheesecake was!!",2017-08-04 03:02:38
h1DkNJ6ylr3O7REfl_h0Qg,hRLUlQHfGI0AdHDGhccItw,L8rJht4Jw_BuR8gsckEWYg,4.0,0,0,0,"Last time we came was 3.5 hour wait but this time was 45 minutes! Loved everything, food was great, the nachos were AMAZING! We got the lemon raspberry and the salted caramel cheesecake. But, our waiter barely came to our table to check up on us and was not organized. I think that is due to the fact that they were understaffed. I still love the Cheesecake Factory!",2018-02-19 15:27:37
uSuB58oud7oArnBg0JIV4w,8oDqavYY4Jk7K2Git34ucw,L8rJht4Jw_BuR8gsckEWYg,2.0,0,0,0,"Last weekend while running some errands in Charlotte, my husband, daughter and myself decided that it was time to hit up The Cheesecake Factory. Any other time we have gone, the food is always okay but pricey and we always get two pieces of cheesecake to share. This time around, my husband ordered the meatloaf lunch and when he got it, the meatloaf was dry and he compared it to chow hall food in the military. He said chow hall food was better than that! When the waiter came back like 15 minutes later, I told him that the food as gross. He took it away and never said a word. The manager popped up about 10 minutes later and offered him a menu but told him that everyone's tastes are different and they have never had a complaint about the meatloaf before. My thoughts were, ""it's dry and tough....Who would eat that?"" My husband just ordered a soup and salad lunch combo after he got another menu which was priced at like $15. The salad was horrible and the soup tasted like vegetable water almost. When our waiter came to the table, of course I had to be the one to call out the issues because my husband won't and I didn't want to have to pay for something that he didn't eat. Of course they did nothing about it. They just brought out the cheesecake and made us pay for a meal he did not eat or enjoy. Since I'm heading to Charlotte for my 24th birthday next weekend, I will definitely remember not to go back there and they won't get our business again. We will just mosey on over to Maggiano's for our next big business meeting.",2014-08-06 23:58:14
CEw56CVViD1tHggSSaYEKw,j_G47semHWDQngp2IYV6TQ,L8rJht4Jw_BuR8gsckEWYg,5.0,1,0,0,I've been here like maybe 5 times and I still love this place. They have a wide variety of food. It's a very nice place. The only bad thing is sometimes the wait because this place always has people. Of course it's mostly on like Friday and weekends that the wait is longer but I still love this place. It actually may be my favorite restaurant in Charlotte.,2014-06-03 23:59:41
G5BQMDgORQTJkoeVrF5_OQ,7VVLHIxJPP6_yREVf444sg,L8rJht4Jw_BuR8gsckEWYg,4.0,0,0,0,"I am back to being a Cheesecake Factory customer. I have had several bad experiences at this location, from the customer service to the horrible food. My family decided to try the Cheesecake Factory one more time, since we had a family member that wanted to try it. When we arrived the hostess greeted us and then we were seated with a fantastic waiter named Alex. He was very knowledgeable when it came to the food and recommended a pasta that was just sooooo delicious. He was fun and attentive and really changed our opinion about this location. I will always ask for Alex with the glass and the cool hair.",2016-06-29 13:33:13
opxjyu4mVZFE5Xk_PNt7mw,t-YzhzJ8JV3sFf5gsu2rbg,L8rJht4Jw_BuR8gsckEWYg,4.0,1,0,0,"I'm not the biggest fan of chain restaurants, but Cheesecake Factory is definitely way above par for your normal chain.

The menu is a little pricey, but you definitely get what you pay for. 

The menu is also HUGE. Part of that monstrosity is advertisements (annoying!) but there really is a ton to choose from.

I have weekly (if not daily) day dreams about the Avocado Egg Rolls. Holy moly this appetizer rocks my world! Yes, it's an appetizer, but I actually order it as my entree, whoops. These rolls are chocked full of crazy amounts of flavor and texture. The middle is gooey and savory and the outside is crispy and delicious. And the dipping sauce, some sort of cilantro chutney... SHUT UP! It's amazing.

I also really enjoy the Sweet Corn Tamale Cakes appetizer. These little babies are sweet and salty at the same time. Very filling. Nice presentation.

My favorite appetizer salad is the French Country Salad. Veggie friendly and delish.

The only thing I've had here I have NOT enjoyed was Evelyn's Favorite Pasta. It's pretty boring and lackluster, I do not recommend.

And last but definitely not least, their namesake... the CHEESECAKES. Oh lord. Yes, It's okay to come here just for cheesecake. No one will judge you.

I would like to say I've tried them all. Unfortunately I'm in love with the Tiramisu and order it EVERY time. Except for in the fall and winter when The Pumpkin Pecan Cheesecake is in season.",2013-04-07 15:45:43
lfSCEW38hn3-GQza8Yw8Tw,O4Zp3A250mFwziIq2DKVug,L8rJht4Jw_BuR8gsckEWYg,4.0,0,0,0,"Our waitress was awesome on Easter Sunday.....
I tried the pineapple shrimp and chicken with white rice
The rice wasn't as tender as I like it but the flavor of the sauce on top of the chicken and shrimp was tasty.
And of course I had to get a slice of cheesecake to take with me",2018-04-03 18:30:00
NAOAbfjd_mtpBaJy6pCjNg,uH30tacIr8m4xhS-ovYmag,L8rJht4Jw_BuR8gsckEWYg,1.0,0,0,0,Will never come back to this CF. waited for 1.5 hours for our simple curbside pickup order. Horrible service. No one knew what was going on..,2017-10-08 23:58:19
WGSXRIfslvGwLL3k7EdHCQ,x37OyP--VEFE5p-xreplYA,L8rJht4Jw_BuR8gsckEWYg,4.0,1,0,0,"If you can't find something you love from Cheesecake's extensive menu, something is wrong with you. The white sangria was strong, sweet and delicious. 

Avocado egg rolls are perfect. Crispy exterior and soft flavorful interior. I like it dipped in their homemade ranch better than the sweet dipping sauce the egg rolls come with. 

Chili Rellenos were somewhat disappointing. The hot, melty pepper jack cheese inside is awesome, but the pepper has a very green pepper flavor rather than any spiciness. The crunchy fried outside is good but overall this was a miss for me. Not really worth the calories. 

The veggie burger was made with beets (along with brown rice, farro and black bean) and was not good at all. It was cold and sweet and bland. 

You can't go wrong with any of the desserts. We had the banana cream cheesecake, which is our standby favorite. And I also tried Chris' Outrageous Cheesecake, made with layers of brownie, coconut cheesecake, chocolate cake, coconut frosting (similar to the topping for German chocolate cake) and whipped cream. It was good, but I've had better.",2013-09-26 03:44:45
tpnALlPhphVwfBAXqJhYew,Wr1lF1B3O48txTH7wm-O1A,L8rJht4Jw_BuR8gsckEWYg,1.0,0,5,0,"I loved Cheesecake Factory until today...I visited as soon as they opened at Southpark more than 10 years ago and have been back often!
Today I purchased a slice of the birthday cheesecake TO GO....which came to $11 with a tip from TAKEOUT!
I stopped to pump gas and my puppy ate 1\/2 of it by the time I noticed....I immediately called them and explained that the slice was for my child.  I have a 30 minute drive home....they kept me on hold to ask a manager for over 15 minutes who told me sorry they could not replace the slice......
Oh well...thats the last time I solicit Cheesecake either in Charlotte or elsewhere.",2018-04-11 01:54:54
KwLXjgWh1cicegthbh8Eeg,PN6lYym62G8NAaXgbMaSpg,L8rJht4Jw_BuR8gsckEWYg,2.0,0,0,0,"Roll the dice to see if they actually give you what you order.  This place has the worst customer service.  The food is tasty what with all the salt and fat and all.  However, they ALWAYS seem to get something wrong, leave something out, include a hair, etc.  My rule is if the food is expensive (like it is here) I do not give the restaurant much room for error with my order.",2014-09-19 17:59:55
